{
  "run_id": "example-17",
  "event_id": "EXAMPLE",
  "start_utc_ns": "1791231600000000000",
  "end_utc_ns": "1791231780000000000",
  "range_origin": {
    "latitude_deg": 40.0,
    "longitude_deg": -100.0,
    "height_ellipsoid_m": 700.0
  },
  "stations": [
    {
      "station_id": "north",
      "position": {
        "latitude_deg": 40.0134747,
        "longitude_deg": -100.0,
        "height_ellipsoid_m": 702.0
      },
      "camera_ids": [
        "north-narrow",
        "north-wide",
        "north-mwir"
      ]
    },
    {
      "station_id": "east",
      "position": {
        "latitude_deg": 40.0,
        "longitude_deg": -99.9824101,
        "height_ellipsoid_m": 702.0
      },
      "camera_ids": [
        "east-narrow",
        "east-wide",
        "east-mwir"
      ]
    },
    {
      "station_id": "west",
      "position": {
        "latitude_deg": 40.0,
        "longitude_deg": -100.0175899,
        "height_ellipsoid_m": 702.0
      },
      "camera_ids": [
        "west-narrow",
        "west-wide",
        "west-mwir"
      ]
    }
  ],
  "software_revision": "b47b069880f4157d994e2f19a437be865833a78e",
  "parameter_files": [
    {
      "path": "parameters/pointing-model.toml",
      "sha256_hex": "4ef45d4ed88c12d2732613624c0a4b72744a3bde3399e91fc1b3da749b957493",
      "size_bytes": "6073551",
      "media_type": "application/toml"
    },
    {
      "path": "parameters/drag-table.toml",
      "sha256_hex": "cd4d8c07f4518a57ad4c654998f562119edb474f0f9b372bcd3fc169dcd313f8",
      "size_bytes": "4841784",
      "media_type": "application/toml"
    },
    {
      "path": "parameters/kill-thresholds.toml",
      "sha256_hex": "07867bcb955c48afa25ad320ae244ef86aebf24e9b839bc85c577ddca0357619",
      "size_bytes": "6400372",
      "media_type": "application/toml"
    }
  ],
  "models": [
    {
      "path": "models/segmentation.onnx",
      "sha256_hex": "e142715dba257bf92f44972faaefafe5e0b7ea248cdbf2bd7729397646001bab",
      "size_bytes": "4437670",
      "media_type": "application/onnx"
    }
  ],
  "artifacts": [
    {
      "path": "tracks.binpb",
      "sha256_hex": "8b2546d2a69710ec8c0a341c7f6073bc674cede2359dbeead29a298c774452bb",
      "size_bytes": "1840011",
      "media_type": "application/x-protobuf"
    },
    {
      "path": "frame-metadata.binpb",
      "sha256_hex": "f0266f67a75f1ab7c3a3feb1a41214d5a388aa82a8ed36d5e48097cd67b52420",
      "size_bytes": "3343358",
      "media_type": "application/x-protobuf"
    },
    {
      "path": "pli.binpb",
      "sha256_hex": "bce26fcd1efe61d8add7103383cb08043e9048d62b72e5ab462030f8b47e7471",
      "size_bytes": "1361120",
      "media_type": "application/x-protobuf"
    },
    {
      "path": "fragments.binpb",
      "sha256_hex": "444158e8b45241ee77b9a39bab609be0fb9293dc4c5ef1df3bbcd99235978092",
      "size_bytes": "2386760",
      "media_type": "application/x-protobuf"
    }
  ],
  "kill_assessment": {
    "run_id": "example-17",
    "target_track_id": "target",
    "interceptor_track_id": "interceptor",
    "computed_class": "KILL_CLASS_CATASTROPHIC_KILL",
    "closest_approach_utc_ns": "1791231649400000000",
    "contact_utc_ns": "1791231649400000000",
    "miss_distance_m": 0.22,
    "miss_distance_sigma_m": 0.02,
    "intercept_point_enu_m": {
      "east": 829.0,
      "north": 1291.0,
      "up": 205.0
    },
    "breakup_piece_count": 17,
    "ballistic_fit_residual": 1.45,
    "mission_denied": true,
    "thresholds": [
      {
        "name": "N",
        "value": 5.0,
        "unit": "1"
      },
      {
        "name": "m",
        "value": 0.01,
        "unit": "kg"
      },
      {
        "name": "T",
        "value": 10.0,
        "unit": "s"
      },
      {
        "name": "residual_gate",
        "value": 3.0,
        "unit": "1"
      }
    ],
    "thresholds_file": {
      "path": "parameters/kill-thresholds.toml",
      "sha256_hex": "07867bcb955c48afa25ad320ae244ef86aebf24e9b839bc85c577ddca0357619",
      "size_bytes": "6400372",
      "media_type": "application/toml"
    },
    "overrides": []
  },
  "footprint": {
    "run_id": "example-17",
    "sample_count": 10000,
    "fragment_ids": [
      "fragment-01",
      "fragment-02",
      "fragment-03",
      "fragment-04",
      "fragment-05",
      "fragment-06",
      "fragment-07",
      "fragment-08",
      "fragment-09",
      "fragment-10",
      "fragment-11",
      "fragment-12",
      "fragment-13",
      "fragment-14",
      "fragment-15",
      "fragment-16",
      "fragment-17"
    ],
    "regions": [
      {
        "probability": 0.5,
        "polygons": [
          {
            "vertices": [
              {
                "latitude_deg": 40.0113726,
                "longitude_deg": -99.99022,
                "height_ellipsoid_m": 700.0
              },
              {
                "latitude_deg": 40.0113726,
                "longitude_deg": -99.9896337,
                "height_ellipsoid_m": 700.0
              },
              {
                "latitude_deg": 40.0118218,
                "longitude_deg": -99.9896337,
                "height_ellipsoid_m": 700.0
              },
              {
                "latitude_deg": 40.0118218,
                "longitude_deg": -99.99022,
                "height_ellipsoid_m": 700.0
              }
            ]
          }
        ]
      },
      {
        "probability": 0.9,
        "polygons": [
          {
            "vertices": [
              {
                "latitude_deg": 40.0110582,
                "longitude_deg": -99.9906304,
                "height_ellipsoid_m": 700.0
              },
              {
                "latitude_deg": 40.0110582,
                "longitude_deg": -99.9892232,
                "height_ellipsoid_m": 700.0
              },
              {
                "latitude_deg": 40.0121362,
                "longitude_deg": -99.9892232,
                "height_ellipsoid_m": 700.0
              },
              {
                "latitude_deg": 40.0121362,
                "longitude_deg": -99.9906304,
                "height_ellipsoid_m": 700.0
              }
            ]
          }
        ]
      },
      {
        "probability": 0.99,
        "polygons": [
          {
            "vertices": [
              {
                "latitude_deg": 40.0106091,
                "longitude_deg": -99.9912168,
                "height_ellipsoid_m": 700.0
              },
              {
                "latitude_deg": 40.0106091,
                "longitude_deg": -99.9886369,
                "height_ellipsoid_m": 700.0
              },
              {
                "latitude_deg": 40.0125853,
                "longitude_deg": -99.9886369,
                "height_ellipsoid_m": 700.0
              },
              {
                "latitude_deg": 40.0125853,
                "longitude_deg": -99.9912168,
                "height_ellipsoid_m": 700.0
              }
            ]
          }
        ]
      }
    ],
    "inputs": [
      {
        "path": "inputs/wind-profile.json",
        "sha256_hex": "daa88e0a6ecb1dd4e923f1a1ca8b886cd76688cc033f48a3ab5a5d60b4e8a298",
        "size_bytes": "4385870",
        "media_type": "application/json"
      },
      {
        "path": "parameters/drag-table.toml",
        "sha256_hex": "cd4d8c07f4518a57ad4c654998f562119edb474f0f9b372bcd3fc169dcd313f8",
        "size_bytes": "4841784",
        "media_type": "application/toml"
      }
    ]
  },
  "measurements": [
    {
      "criterion_id": "3.1.2",
      "value": 1.0,
      "unit": "1",
      "sigma": 0.0
    },
    {
      "criterion_id": "3.1.3",
      "value": 2020.828,
      "sigma": 1.5,
      "unit": "m"
    },
    {
      "criterion_id": "3.1.4",
      "value": 20.9,
      "sigma": 0.001,
      "unit": "s"
    },
    {
      "criterion_id": "INT-1",
      "value": 85.5,
      "sigma": 0.5,
      "unit": "m/s"
    },
    {
      "criterion_id": "INT-2",
      "value": 69.0,
      "sigma": 1.0,
      "unit": "m/s2"
    },
    {
      "criterion_id": "INT-6",
      "value": 0.22,
      "sigma": 0.02,
      "unit": "m"
    }
  ],
  "flags": [
    "FLAG_TIME_DEGRADED"
  ]
}
