{
  "run_id": "example-18",
  "event_id": "EXAMPLE",
  "start_utc_ns": "1791232800000000000",
  "end_utc_ns": "1791232980000000000",
  "range_origin": {
    "latitude_deg": 40.0,
    "longitude_deg": -100.0,
    "height_ellipsoid_m": 700.0
  },
  "stations": [
    {
      "station_id": "north",
      "position": {
        "latitude_deg": 40.0134747,
        "longitude_deg": -100.0,
        "height_ellipsoid_m": 702.0
      },
      "camera_ids": [
        "north-narrow",
        "north-wide",
        "north-mwir"
      ]
    },
    {
      "station_id": "east",
      "position": {
        "latitude_deg": 40.0,
        "longitude_deg": -99.9824101,
        "height_ellipsoid_m": 702.0
      },
      "camera_ids": [
        "east-narrow",
        "east-wide",
        "east-mwir"
      ]
    },
    {
      "station_id": "west",
      "position": {
        "latitude_deg": 40.0,
        "longitude_deg": -100.0175899,
        "height_ellipsoid_m": 702.0
      },
      "camera_ids": [
        "west-narrow",
        "west-wide",
        "west-mwir"
      ]
    }
  ],
  "software_revision": "b47b069880f4157d994e2f19a437be865833a78e",
  "parameter_files": [
    {
      "path": "parameters/pointing-model.toml",
      "sha256_hex": "f621c910f71ca4ee58691cf2ed24c9de2be24b88643867d07fbd809219199f8f",
      "size_bytes": "6075068",
      "media_type": "application/toml"
    },
    {
      "path": "parameters/drag-table.toml",
      "sha256_hex": "235a5e1b881774f1ae6a7d69c306e9967c5d565579ec9a47fe6ec3bcba09bef3",
      "size_bytes": "4843153",
      "media_type": "application/toml"
    },
    {
      "path": "parameters/kill-thresholds.toml",
      "sha256_hex": "02fc500046abadd13c0a2a65c39600a67254ea05f67d3e4268bd7e9661089db9",
      "size_bytes": "6401926",
      "media_type": "application/toml"
    }
  ],
  "models": [
    {
      "path": "models/segmentation.onnx",
      "sha256_hex": "869fe0e7605d7271e410c8ee0e315460ef25c8475976ed1d78046a52143d004a",
      "size_bytes": "4438965",
      "media_type": "application/onnx"
    }
  ],
  "artifacts": [
    {
      "path": "tracks.binpb",
      "sha256_hex": "9a1a89ca648dcd9282e75e4c055dddafaf89675f326d5048a8edeeaa1edc783a",
      "size_bytes": "1840862",
      "media_type": "application/x-protobuf"
    },
    {
      "path": "frame-metadata.binpb",
      "sha256_hex": "2fe38a5afcbb42cee564558d19a699184dba9046f6d3315c570101dbf5e1f7a6",
      "size_bytes": "3344505",
      "media_type": "application/x-protobuf"
    },
    {
      "path": "pli.binpb",
      "sha256_hex": "17fbc09cb22dd5f3be78960ffcf2a322d4b6366d599f87bfda817e3a1756fd11",
      "size_bytes": "1361860",
      "media_type": "application/x-protobuf"
    }
  ],
  "kill_assessment": {
    "run_id": "example-18",
    "target_track_id": "target",
    "interceptor_track_id": "interceptor",
    "computed_class": "KILL_CLASS_MISSION_KILL",
    "closest_approach_utc_ns": "1791232850600000000",
    "miss_distance_m": 6.0,
    "miss_distance_sigma_m": 0.02,
    "intercept_point_enu_m": {
      "east": 866.0,
      "north": 1314.0,
      "up": 210.0
    },
    "mission_denied": true,
    "thresholds": [
      {
        "name": "N",
        "value": 5.0,
        "unit": "1"
      },
      {
        "name": "m",
        "value": 0.01,
        "unit": "kg"
      },
      {
        "name": "T",
        "value": 10.0,
        "unit": "s"
      },
      {
        "name": "residual_gate",
        "value": 3.0,
        "unit": "1"
      }
    ],
    "thresholds_file": {
      "path": "parameters/kill-thresholds.toml",
      "sha256_hex": "02fc500046abadd13c0a2a65c39600a67254ea05f67d3e4268bd7e9661089db9",
      "size_bytes": "6401926",
      "media_type": "application/toml"
    },
    "breakup_piece_count": 0,
    "overrides": []
  },
  "measurements": [
    {
      "criterion_id": "3.1.2",
      "value": 1.0,
      "unit": "1",
      "sigma": 0.0
    },
    {
      "criterion_id": "3.1.3",
      "value": 2062.002,
      "sigma": 1.5,
      "unit": "m"
    },
    {
      "criterion_id": "3.1.4",
      "value": 21.6,
      "sigma": 0.001,
      "unit": "s"
    },
    {
      "criterion_id": "INT-1",
      "value": 87.0,
      "sigma": 0.5,
      "unit": "m/s"
    },
    {
      "criterion_id": "INT-2",
      "value": 71.0,
      "sigma": 1.0,
      "unit": "m/s2"
    },
    {
      "criterion_id": "INT-6",
      "value": 6.0,
      "sigma": 0.02,
      "unit": "m"
    }
  ],
  "flags": []
}
